Title,Images,Category,Body,Description,Link,Tlink
Mauris eget quam orci,"image_blog_1.png, image_blog_2.png, image_blog_3.png, image_blog_4.png","Praesent, Maecenas","<p>Maecenas mattis fermentum arcu id adipiscing! Nullam pretium pulvinar elementum. Donec eu tellus adipiscing tortor pellentesque varius ac a augue. Duis non diam non sem porta euismod! Nulla at risus nec mi egestas cursus id quis leo. Mauris accumsan elit non lorem porta iaculis? Integer ultrices adipiscing posuere. In tincidunt ligula ac ligula mattis eu porta metus viverra! Cras at quam velit, sit amet mollis dui. Quisque rhoncus, urna vitae molestie volutpat, ligula augue tincidunt orci, id placerat mi tellus at sem! Duis at magna id augue vulputate feugiat? Nulla vehicula libero vel neque vulputate euismod. In et enim risus. Vivamus aliquet posuere luctus. Donec ante neque, aliquet sed volutpat hendrerit, accumsan vel tellus. Nullam auctor pretium risus; sed tincidunt dolor iaculis sit amet. Nunc scelerisque, nibh a dictum varius, tortor odio blandit libero, et accumsan purus leo eget nibh. Sed lobortis massa vitae quam faucibus vestibulum. Praesent mollis feugiat metus eget eleifend. Quisque blandit sapien non augue eleifend eu pellentesque lacus placerat. Donec ligula tellus; feugiat id tempor ac, blandit iaculis sem. Nullam elementum suscipit faucibus. Pellentesque massa nunc.</p>","<p>Contrary to popular belief, Lorem Ipsum is not simply random text. It has roots in a piece of classical Latin literature from 45 BC, making it over 2000 years old. Richard McClintock, a Latin professor at Hampden-Sydney College in Virginia, looked up one of the more obscure Latin words, consectetur, from a Lorem Ipsum passage, and going through the cites of the word in classical literature</p>",http://www.themeski.com,View project
Sed odio magna pellentesque eget,"image_blog_2.png, image_blog_1.png, image_blog_3.png","Donec, Maecenas","<p>Lorem ipsum dolor sit amet, consectetur adipiscing elit. Mauris eget quam orci. Quisque porta varius dui, quis posuere nibh mollis quis. </p><p>Mauris commodo rhoncus porttitor. </p><p>Maecenas et euismod elit. </p><p>Nulla facilisi.</p> <p>Vivamus lacus libero, ultrices non ullamcorper ac, tempus sit amet enim.</p><p> Suspendisse at semper ipsum.</p><p> Suspendisse sagittis diam a massa viverra sollicitudin. </p><p>Vivamus sagittis est eu diam fringilla nec tristique metus vestibulum.</p>","<p>There are many variations of passages of Lorem Ipsum available, but the majority have suffered alteration in some form, by injected humour, or randomised words</p>",http://www.themeski.com,View project
Sed odio magna pellentesque eget convallis ac vehicula vel arcu,"image_blog_3.png, image_blog_4.png, image_blog_5.png, image_blog_6.png","Maecenas, Nulla","<p>Lorem ipsum dolor sit amet, consectetur adipiscing elit. Mauris eget quam orci. Quisque porta varius dui, quis posuere nibh mollis quis. Mauris commodo rhoncus.<p>Contrary to popular belief, Lorem Ipsum is not simply random text. It has roots in a piece of classical Latin literature from 45 BC, making it over 2000 years old. Richard McClintock, a Latin professor at Hampden-Sydney College in Virginiaporttitor. Maecenas et euismod elit. Nulla facilisi.</p> <p>Vivamus lacus libero, ultrices non ullamcorper ac, tempus sit amet enim.Suspendisse at semper ipsum.Suspendisse sagittis diam a massa viverra sollicitudin. Vivamus sagittis est eu diam fringilla nec tristique metus vestibulum.</p>",<p>It is a long established fact that a reader will be distracted by the readable content of a page when looking at its layout. The point of using Lorem Ipsum is</p>,http://www.themeski.com,View project
In magna nulla pellentesque a lobortis at,image_blog_4.png,"Nulla, Praesent","<p>As a merchant, can you imagine all of the benefits with allowing your customers register with Facebook or Twitter?</p><p><strong>Customer Information</strong> - This allows you to capture the email addresses before they ever get to checkout and other additional personal information that your customers don’t mind sharing, but definitely don’t want to have to fill out another form for it.</p><p><strong>Sharing is Good</strong> - By embracing social media, you’re tapping into a wealth of shareable products. Imagine making it super easy for your customers to share that neat thing that only their friends would understand!</p><p><strong>Request more than the default access</strong> - With just a little bit of configuration you can map their birthday to a user registration field that gets saved to your system. The potential of useful information is only limited by your imagination!</p><p>Read more at <a href='http://www.drupalcommerce.org/blog/4571/kickstart-tip-1-social-logins-made-simple'>CommerceGuys.com</a></p>","<p>Many desktop publishing packages and web page editors now use Lorem Ipsum as their default model text, and a search for 'lorem ipsum' will uncover many</p>",http://www.themeski.com,View project
Mauris elementum accumsan leo vel tempor sagittis diam vel enim tempus sit amet cursus nisl aliquam,"image_blog_5.png, image_blog_6.png, image_blog_7.png, image_blog_8.png","Donec, Nulla","<p>Commerce Guys provide many screencasts around the Drupal Commerce ecosystem to demonstrate how you can easily extend your store using contributed modules.This tuesday, let's talk about Commerce Customizable Products which is another module that provides custom line item types like Commerce Custom Line Items.Watch the <a href='http://drupalcommerce.org/videos/commerce-module-tuesday/commerce-customizable-products'>screencast</a>.Find more videos at <a href='http://drupalcommerce.org/videos'>DrupalCommerce.org</a></p>","<p>Lorem Ipsum, you need to be sure there isn't anything embarrassing hidden in the middle of text. All the Lorem Ipsum generators on the Internet tend to repeat</p>",http://www.themeski.com,View project
Cras ornare diam nec tortor,image_blog_6.png,"Donec, Maecenas","<p>Donec sed odio dui. Duis mollis, est non commodo luctus, nisi erat porttitor ligula, eget lacinia odio sem nec elit. Sed posuere consectetur est at lobortis. Nulla vitae elit libero, a pharetra augue. Donec ullamcorper nulla non metus auctor fringilla. Donec id elit non mi porta gravida at eget metus. Fusce dapibus, tellus ac cursus commodo, tortor mauris condimentum nibh, ut fermentum massa justo sit amet risus.Lorem ipsum dolor sit amet, consectetur adipiscing elit. Etiam porta sem malesuada magna mollis euismod. Aenean eu leo quam.</p><h2>H2 Heading Text</h2><p>Donec id elit non mi porta gravida at eget metus. Aenean lacinia bibendum nulla sed consectetur. Vivamus sagittis lacus vel augue laoreet rutrum faucibus dolor auctor. Donec ullamcorper nulla non metus auctor fringilla. Donec ullamcorper nulla non metus auctor fringilla. Integer posuere erat a ante venenatis dapibus posuere velit aliquet.</p><h3>Blockquote</h3><blockquote class=""center""><p>Duis mollis, est non commodo luctus, nisi erat porttitor ligula, eget lacinia odio sem nec elit. Integer posuere erat a ante venenatis dapibus posuere velit aliquet. Donec ullamcorper nulla non metus auctor fringilla.</p></blockquote><h4>H4 Heading Text</h4><p>Pellentesque ornare sem lacinia quam venenatis vestibulum. Aenean lacinia bibendum nulla sed consectetur.Cras mattis consectetur purus sit amet fermentum. Sed posuere consectetur est at lobortis. Nulla vitae elit libero, a pharetra augue. Lorem ipsum dolor sit amet, consectetur adipiscing elit. Donec id elit non mi porta gravida at eget metus. Vestibulum id ligula porta felis euismod semper. Vestibulum id ligula porta felis euismod semper.</p><p>Aenean eu leo quam. Pellentesque ornare sem lacinia quam venenatis vestibulum. Cum sociis natoque penatibus et magnis dis parturient montes, nascetur ridiculus mus. Duis mollis, est non commodo luctus, nisi erat porttitor ligula, eget lacinia odio sem nec elit. Integer posuere erat a ante venenatis dapibus posuere velit aliquet.</p>",<p>It is a long established fact that a reader will be distracted by the readable content of a page when looking at its layout. The point of using Lorem Ipsum is</p>,http://www.themeski.com,View project
Pellentesque non viverra nibh,"image_blog_7.png, image_blog_1.png, image_blog_8.png, image_blog_5.png","Maecenas, Nulla","<p>Donec sed odio dui. Duis mollis, est non commodo luctus, nisi erat porttitor ligula, eget lacinia odio sem nec elit.Sed posuere consectetur est at lobortis. Nulla vitae elit libero, a pharetra augue. Donec ullamcorper nulla non metus auctor fringilla. Donec id elit non mi porta gravida at eget metus. Fusce dapibus, tellus ac cursus commodo, tortor mauris condimentum nibh, ut fermentum massa justo sit amet risus.Lorem ipsum dolor sit amet, consectetur adipiscing elit. Etiam porta sem malesuada magna mollis euismod. Aenean eu leo quam.</p>","<p>Contrary to popular belief, Lorem Ipsum is not simply random text. It has roots in a piece of classical Latin literature from 45 BC, making it over 2000 years old. Richard McClintock, a Latin professor at Hampden-Sydney College in Virginia</p>",http://www.themeski.com,View project
Aliquam erat volutpat Praesent in viverra dolor,"image_blog_8.png, image_blog_9.png, image_blog_10.png","Nulla, Praesent","<p>Donec sed odio dui. Duis mollis, est non commodo luctus, nisi erat porttitor ligula, eget lacinia odio sem nec elit. Sed posuere consectetur est at lobortis. Nulla vitae elit libero, a pharetra augue. Donec ullamcorper nulla non metus auctor fringilla. Donec id elit non mi porta gravida at eget metus. Fusce dapibus, tellus ac cursus commodo, tortor mauris condimentum nibh, ut fermentum massa justo sit amet risus.Lorem ipsum dolor sit amet, consectetur adipiscing elit. Etiam porta sem malesuada magna mollis euismod. Aenean eu leo quam.</p><h2>H2 Heading Text</h2><p>Donec id elit non mi porta gravida at eget metus. Aenean lacinia bibendum nulla sed consectetur. Vivamus sagittis lacus vel augue laoreet rutrum faucibus dolor auctor. Donec ullamcorper nulla non metus auctor fringilla. Donec ullamcorper nulla non metus auctor fringilla. Integer posuere erat a ante venenatis dapibus posuere velit aliquet.</p><h3>Blockquote</h3><blockquote class=""center""><p>Duis mollis, est non commodo luctus, nisi erat porttitor ligula, eget lacinia odio sem nec elit. Integer posuere erat a ante venenatis dapibus posuere velit aliquet. Donec ullamcorper nulla non metus auctor fringilla.</p></blockquote><h4>H4 Heading Text</h4><p>Pellentesque ornare sem lacinia quam venenatis vestibulum. Aenean lacinia bibendum nulla sed consectetur.Cras mattis consectetur purus sit amet fermentum. Sed posuere consectetur est at lobortis. Nulla vitae elit libero, a pharetra augue. Lorem ipsum dolor sit amet, consectetur adipiscing elit. Donec id elit non mi porta gravida at eget metus. Vestibulum id ligula porta felis euismod semper. Vestibulum id ligula porta felis euismod semper.</p><p>Aenean eu leo quam. Pellentesque ornare sem lacinia quam venenatis vestibulum. Cum sociis natoque penatibus et magnis dis parturient montes, nascetur ridiculus mus. Duis mollis, est non commodo luctus, nisi erat porttitor ligula, eget lacinia odio sem nec elit. Integer posuere erat a ante venenatis dapibus posuere velit aliquet.</p>","<p>Contrary to popular belief, Lorem Ipsum is not simply random text. It has roots in a piece of classical Latin literature from 45 BC, making it over 2000 years old. Richard McClintock, a Latin professor at Hampden-Sydney College in Virginia</p>",http://www.themeski.com,View project
Aliquam turpis leo viverra id leo eu,image_blog_9.png,"Donec, Nulla","<p>Donec sed odio dui. Duis mollis, est non commodo luctus, nisi erat porttitor ligula, eget lacinia odio sem nec elit. Sed posuere consectetur est at lobortis. Nulla vitae elit libero, a pharetra augue.Donec ullamcorper nulla non metus auctor fringilla.Donec id elit non mi porta gravida at eget metus. Fusce dapibus, tellus ac cursus commodo, tortor mauris condimentum nibh, ut fermentum massa justo sit amet risus.Lorem ipsum dolor sit amet, consectetur adipiscing elit. Etiam porta sem malesuada magna mollis euismod. Aenean eu leo quam.</p>",<p>It is a long established fact that a reader will be distracted by the readable content of a page when looking at its layout. The point of using Lorem Ipsum is</p>,http://www.themeski.com,View project
Praesent tincidunt dapibus nisi,image_blog_10.png,"Nulla, Praesent","<p>Donec sed odio dui. Duis mollis, est non commodo luctus, nisi erat porttitor ligula, eget lacinia odio sem nec elit. Sed posuere consectetur est at lobortis. Nulla vitae elit libero, a pharetra augue. Donec ullamcorper nulla non metus auctor fringilla. Donec id elit non mi porta gravida at eget metus. Fusce dapibus, tellus ac cursus commodo, tortor mauris condimentum nibh, ut fermentum massa justo sit amet risus.Lorem ipsum dolor sit amet, consectetur adipiscing elit. Etiam porta sem malesuada magna mollis euismod. Aenean eu leo quam.</p><h2>H2 Heading Text</h2><p>Donec id elit non mi porta gravida at eget metus. Aenean lacinia bibendum nulla sed consectetur. Vivamus sagittis lacus vel augue laoreet rutrum faucibus dolor auctor. Donec ullamcorper nulla non metus auctor fringilla. Donec ullamcorper nulla non metus auctor fringilla. Integer posuere erat a ante venenatis dapibus posuere velit aliquet.</p><h3>Blockquote</h3><blockquote class=""center""><p>Duis mollis, est non commodo luctus, nisi erat porttitor ligula, eget lacinia odio sem nec elit. Integer posuere erat a ante venenatis dapibus posuere velit aliquet. Donec ullamcorper nulla non metus auctor fringilla.</p></blockquote><h4>H4 Heading Text</h4><p>Pellentesque ornare sem lacinia quam venenatis vestibulum. Aenean lacinia bibendum nulla sed consectetur.Cras mattis consectetur purus sit amet fermentum. Sed posuere consectetur est at lobortis. Nulla vitae elit libero, a pharetra augue. Lorem ipsum dolor sit amet, consectetur adipiscing elit. Donec id elit non mi porta gravida at eget metus. Vestibulum id ligula porta felis euismod semper. Vestibulum id ligula porta felis euismod semper.</p><p>Aenean eu leo quam. Pellentesque ornare sem lacinia quam venenatis vestibulum. Cum sociis natoque penatibus et magnis dis parturient montes, nascetur ridiculus mus. Duis mollis, est non commodo luctus, nisi erat porttitor ligula, eget lacinia odio sem nec elit. Integer posuere erat a ante venenatis dapibus posuere velit aliquet.</p>","<p>Lorem Ipsum, you need to be sure there isn't anything embarrassing hidden in the middle of text. All the Lorem Ipsum generators on the Internet tend to repeat</p>",http://www.themeski.com,View project
Sed odio magna pellentesque eget,"image_blog_2.png, image_blog_1.png, image_blog_3.png","Maecenas, Nulla","<p>Lorem ipsum dolor sit amet, consectetur adipiscing elit. Mauris eget quam orci. Quisque porta varius dui, quis posuere nibh mollis quis. </p><p>Mauris commodo rhoncus porttitor. </p><p>Maecenas et euismod elit. </p><p>Nulla facilisi.</p> <p>Vivamus lacus libero, ultrices non ullamcorper ac, tempus sit amet enim.</p><p> Suspendisse at semper ipsum.</p><p> Suspendisse sagittis diam a massa viverra sollicitudin. </p><p>Vivamus sagittis est eu diam fringilla nec tristique metus vestibulum.</p>","<p>There are many variations of passages of Lorem Ipsum available, but the majority have suffered alteration in some form, by injected humour, or randomised words</p>",http://www.themeski.com,View project
In magna nulla pellentesque a lobortis at,image_blog_4.png,"Praesent, Maecenas","<p>As a merchant, can you imagine all of the benefits with allowing your customers register with Facebook or Twitter?</p><p><strong>Customer Information</strong> - This allows you to capture the email addresses before they ever get to checkout and other additional personal information that your customers don’t mind sharing, but definitely don’t want to have to fill out another form for it.</p><p><strong>Sharing is Good</strong> - By embracing social media, you’re tapping into a wealth of shareable products. Imagine making it super easy for your customers to share that neat thing that only their friends would understand!</p><p><strong>Request more than the default access</strong> - With just a little bit of configuration you can map their birthday to a user registration field that gets saved to your system. The potential of useful information is only limited by your imagination!</p><p>Read more at <a href='http://www.drupalcommerce.org/blog/4571/kickstart-tip-1-social-logins-made-simple'>CommerceGuys.com</a></p>","<p>Many desktop publishing packages and web page editors now use Lorem Ipsum as their default model text, and a search for 'lorem ipsum' will uncover many</p>",http://www.themeski.com,View project
Pellentesque non viverra nibh,"image_blog_7.png, image_blog_1.png, image_blog_8.png, image_blog_5.png","Maecenas, Nulla","<p>Donec sed odio dui. Duis mollis, est non commodo luctus, nisi erat porttitor ligula, eget lacinia odio sem nec elit.Sed posuere consectetur est at lobortis. Nulla vitae elit libero, a pharetra augue. Donec ullamcorper nulla non metus auctor fringilla. Donec id elit non mi porta gravida at eget metus. Fusce dapibus, tellus ac cursus commodo, tortor mauris condimentum nibh, ut fermentum massa justo sit amet risus.Lorem ipsum dolor sit amet, consectetur adipiscing elit. Etiam porta sem malesuada magna mollis euismod. Aenean eu leo quam.</p>","<p>Contrary to popular belief, Lorem Ipsum is not simply random text. It has roots in a piece of classical Latin literature from 45 BC, making it over 2000 years old. Richard McClintock, a Latin professor at Hampden-Sydney College in Virginia</p>",http://www.themeski.com,View project
